{
  "metadata": {
    "run_id": "run-BTC-USDT-1732000000",
    "ticker": "BTC/USDT",
    "status": "LIVE_TRADING",
    "version": "0.2.0-nexus-nine",
    "pid": 28491,
    "kpis": {
      "pnl_usd": 9951,
      "win_rate_pct": 65.1,
      "latency_ms": 3,
      "kelly_pct": 12.4,
      "opex_saved": 3900000
    }
  },
  "topology": {
    "nodes": [
      {
        "id": "n1",
        "actor": "connectivity",
        "label": "Data Connectivity",
        "status": "COMPLETED",
        "summary": "WS health, drift vs NTP, subscription manifest — no invented prices."
      },
      {
        "id": "n2",
        "actor": "market-scan",
        "label": "Market Microstructure",
        "status": "COMPLETED",
        "summary": "Spread, depth, imbalance, toxicity — L2/L3 features for fusion."
      },
      {
        "id": "n3",
        "actor": "price-pattern",
        "label": "Technical Analysis",
        "status": "COMPLETED",
        "summary": "Multi-TF regime, levels, pattern candidates; flags timeframe conflicts."
      },
      {
        "id": "n4",
        "actor": "sentiment",
        "label": "Sentiment & News",
        "status": "COMPLETED",
        "summary": "Headlines + social velocity, event risk, scored with uncertainty."
      },
      {
        "id": "n5",
        "actor": "quant",
        "label": "Quant Engine",
        "status": "COMPLETED",
        "summary": "Fuses n2–n4 → scorecard, p_hat, attribution, contradiction_index."
      },
      {
        "id": "n6",
        "actor": "strategy-planner",
        "label": "Strategy Planner",
        "status": "ACTIVE",
        "summary": "Order intent: grid/ladder, POST_ONLY, size & slippage caps."
      },
      {
        "id": "n7",
        "actor": "risk-guard",
        "label": "Risk Guard",
        "status": "PENDING",
        "summary": "Veto authority: exposure, Kelly, leverage — APPROVE | REJECT | MODIFY."
      },
      {
        "id": "n8",
        "actor": "compliance",
        "label": "Compliance Gate",
        "status": "PENDING",
        "summary": "Policy pack, allowlist, lineage tags — audit-ready decisions."
      },
      {
        "id": "n9",
        "actor": "nexus-executor",
        "label": "Execution Hub",
        "status": "PENDING",
        "summary": "Venue routing, fees/latency model, slices & post-trade state."
      }
    ],
    "edges": [
      {
        "from": "n1",
        "to": "n2"
      },
      {
        "from": "n1",
        "to": "n3"
      },
      {
        "from": "n1",
        "to": "n4"
      },
      {
        "from": "n2",
        "to": "n5"
      },
      {
        "from": "n3",
        "to": "n5"
      },
      {
        "from": "n4",
        "to": "n5"
      },
      {
        "from": "n5",
        "to": "n6"
      },
      {
        "from": "n6",
        "to": "n7"
      },
      {
        "from": "n7",
        "to": "n8"
      },
      {
        "from": "n8",
        "to": "n9"
      }
    ]
  },
  "traces": [
    {
      "trace_id": "tx-n1-001",
      "node_id": "n1",
      "actor": {
        "id": "connectivity",
        "role": "Data Connectivity",
        "persona": "docs/personas/00_connectivity.md"
      },
      "timestamp": "2024-05-20T10:15:21.050Z",
      "content": {
        "thought_process": [
          {
            "step": 1,
            "label": "Venue ping",
            "detail": "Binance WS RTT p50=14ms p99=38ms; OKX REST 200."
          },
          {
            "step": 2,
            "label": "Clock skew",
            "detail": "Drift vs NTP +2.1ms (within 10ms budget)."
          },
          {
            "step": 3,
            "label": "Subscriptions",
            "detail": "BTCUSDT@depth20@100ms + trade streams armed; replay buffer 2s."
          }
        ],
        "context": {
          "pair": "BTC/USDT",
          "signal": "FEEDS_OK",
          "confidence": 0.99
        }
      }
    },
    {
      "trace_id": "tx-n2-001",
      "node_id": "n2",
      "parent_id": "tx-n1-001",
      "actor": {
        "id": "market-scan",
        "role": "Market Microstructure",
        "persona": "docs/personas/01_market_scanner.md"
      },
      "timestamp": "2024-05-20T10:15:22.100Z",
      "content": {
        "thought_process": [
          {
            "step": 1,
            "label": "Spread",
            "detail": "spread_bps=1.2 vs 24h median 1.4 — slightly tight."
          },
          {
            "step": 2,
            "label": "Depth",
            "detail": "depth_10bps_usd=$38.2M bid / $36.9M ask; imbalance +0.018."
          },
          {
            "step": 3,
            "label": "Toxicity",
            "detail": "toxicity_score=0.22 (low); no sweep clusters in last 60s."
          }
        ],
        "context": {
          "pair": "BTC/USDT",
          "signal": "LIQUIDITY_STRONG",
          "confidence": 0.93
        }
      }
    },
    {
      "trace_id": "tx-n3-001",
      "node_id": "n3",
      "parent_id": "tx-n1-001",
      "actor": {
        "id": "price-pattern",
        "role": "Technical Analysis",
        "persona": "docs/personas/02_technical.md"
      },
      "timestamp": "2024-05-20T10:15:22.800Z",
      "content": {
        "thought_process": [
          {
            "step": 1,
            "label": "Regime",
            "detail": "15m: range; 4h: mild uptrend; ADX 18 (weak trend)."
          },
          {
            "step": 2,
            "label": "Levels",
            "detail": "Resistance 69200–69400; support 67800–68100 from VWAP bands."
          },
          {
            "step": 3,
            "label": "Conflict",
            "detail": "1m momentum negative while 4h bias positive — contradiction note for Quant."
          }
        ],
        "context": {
          "pair": "BTC/USDT",
          "signal": "REGIME_MIXED",
          "confidence": 0.72
        }
      }
    },
    {
      "trace_id": "tx-n4-001",
      "node_id": "n4",
      "parent_id": "tx-n1-001",
      "actor": {
        "id": "sentiment",
        "role": "Sentiment & News",
        "persona": "docs/personas/03_sentiment.md"
      },
      "timestamp": "2024-05-20T10:15:23.400Z",
      "content": {
        "thought_process": [
          {
            "step": 1,
            "label": "Headlines",
            "detail": "ETF flow chatter positive; no fresh exchange FUD in top bucket."
          },
          {
            "step": 2,
            "label": "Score",
            "detail": "sentiment_score=+0.18 with wide CI (thin macro calendar)."
          },
          {
            "step": 3,
            "label": "Event risk",
            "detail": "event_risk=LOW; CPI already digested in prior session."
          }
        ],
        "context": {
          "pair": "BTC/USDT",
          "signal": "SENTIMENT_NEUTRAL_PLUS",
          "confidence": 0.61
        }
      }
    },
    {
      "trace_id": "tx-n5-001",
      "node_id": "n5",
      "parent_id": "tx-n2-001",
      "actor": {
        "id": "quant",
        "role": "Quant Engine",
        "persona": "docs/personas/04_quant.md"
      },
      "timestamp": "2024-05-20T10:15:24.500Z",
      "content": {
        "thought_process": [
          {
            "step": 1,
            "label": "Fusion",
            "detail": "Microstructure bullish-neutral; TA mixed; sentiment slight positive."
          },
          {
            "step": 2,
            "label": "Scorecard",
            "detail": "p_hat=0.58 edge_bps_estimate=3.1 contradiction_index=0.31."
          },
          {
            "step": 3,
            "label": "Attribution",
            "detail": "60% micro, 25% TA, 15% sentiment (by marginal Shapley stub)."
          }
        ],
        "formula": {
          "name": "Logit blend",
          "latex": "p = \\sigma(w_m z_m + w_t z_t + w_s z_s + b)",
          "computed": "p_hat = 0.58"
        },
        "context": {
          "pair": "BTC/USDT",
          "signal": "EDGE_MILD_LONG",
          "confidence": 0.58
        }
      }
    },
    {
      "trace_id": "tx-n6-001",
      "node_id": "n6",
      "parent_id": "tx-n5-001",
      "actor": {
        "id": "strategy-planner",
        "role": "Strategy Planner",
        "persona": "docs/personas/05_strategy.md"
      },
      "timestamp": "2024-05-20T10:15:25.600Z",
      "content": {
        "thought_process": [
          {
            "step": 1,
            "label": "Inventory",
            "detail": "Net flat +0.02 BTC equiv; no skew emergency."
          },
          {
            "step": 2,
            "label": "Grid",
            "detail": "Widen inner quotes +2 bps on ask side only; keep POST_ONLY."
          },
          {
            "step": 3,
            "label": "Safety",
            "detail": "max_slippage_bps=4; cancel stale quotes > 800ms."
          }
        ],
        "proposal": {
          "action": "ADJUST_GRID",
          "params": {
            "symbol": "BTC/USDT",
            "bid_spacing_bps": 2,
            "ask_spacing_bps": 4,
            "size_clip_btc": 0.35,
            "tif": "POST_ONLY"
          }
        },
        "context": {
          "pair": "BTC/USDT",
          "signal": "PROPOSE_GRID_TUNE",
          "confidence": 0.76
        }
      }
    },
    {
      "trace_id": "tx-n7-001",
      "node_id": "n7",
      "parent_id": "tx-n6-001",
      "actor": {
        "id": "risk-guard",
        "role": "Risk Guard",
        "persona": "docs/personas/07_risk_guard.md"
      },
      "timestamp": "2024-05-20T10:15:26.200Z",
      "content": {
        "thought_process": [
          {
            "step": 1,
            "label": "Gross",
            "detail": "Gross notional 3.1% of cap; per-symbol 1.8% — OK."
          },
          {
            "step": 2,
            "label": "Kelly",
            "detail": "f* suggest 11.2%; desk cap 12% — within band."
          },
          {
            "step": 3,
            "label": "Leverage",
            "detail": "Effective lev 3.2x vs limit 5x."
          }
        ],
        "veto_status": {